{
  "stage": "intent-to-implementation",
  "generatedAt": "2026-08-07T16:00:00+08:00",
  "sourceIntentGraphPath": "design/KG/SystemArchitecture.json",
  "summary": "Hexo SSG deployment and content generation verification on Test Cloud Server (120.24.114.13). Scope: (1) promo-hexo-ssg — install Hexo CLI, init site directory, install and configure Butterfly or Icarus theme; (2) promo-content-generation — verify hexo generate produces static HTML to public/ directory. Decision baseline: .argo/history/decision-tree/20260807-argo-promo-website-deploy.md#B1,B2.",
  "intentElementIds": [
    "promo-hexo-ssg",
    "promo-content-generation"
  ],
  "relationshipIds": [
    "promo-rel-hexo-generates"
  ],
  "openQuestions": [],
  "notes": [
    "Viewpoint: Product Viewpoint via promo-website-product-view (parent: BusinessBehaviorViewpoint). View binding verified with description pattern: Viewpoint/Concern/Purpose/Scope/Rationale.",
    "Coverage proof: promo-hexo-ssg has 3 functionalPoints (B1-HexoCLI, B1-SiteInit, B1-ThemeConfig) all mapped to same-element mounted ExplicitAcceptanceTestcase-PROMO-HEXO-SSG. promo-content-generation has 2 functionalPoints (B2-MarkdownToHTML, B2-FrontMatter) all mapped to same-element mounted ExplicitAcceptanceTestcase-PROMO-CONTENT-GEN.",
    "Dependency subgraph: promo-hexo-ssg --Realization--> promo-content-generation. Neither element has deliveryStatus=delivered (new elements, no architecture tests run yet). Both elements are in scope for this handoff. No delivered boundary nodes reached.",
    "Testcase entrypoints: tests/explicit/entries/runPromoHexoSSG.js and tests/explicit/entries/runPromoContentGen.js. These entrypoints are declared in acceptanceCriteria but not yet created; ImplementationDesign owns entrypoint creation.",
    "Per-testcase human approval: both testcases (ExplicitAcceptanceTestcase-PROMO-HEXO-SSG and ExplicitAcceptanceTestcase-PROMO-CONTENT-GEN) were added in this session and require human approval before handoff is dispatched to ImplementationDesign.",
    "Global handoff approval: recorded in this notes field because schema has additionalProperties:false and no approvedByHuman property. Global approval is independent of per-testcase approval and must be confirmed by the human partner before Orchestrator dispatches this handoff."
  ]
}
